{
  "schema_version": "3",
  "source_type": "article",
  "source": "https://example.com/fictional-travel-workflow",
  "raw_content": "A fictional public article says a small pilot can reveal workflow gaps before expansion.",
  "user_insight": "Start with one bounded pilot.",
  "user_context": "Use this for Project Alpha planning.",
  "user_action": "Define the pilot acceptance criteria.",
  "output_goal": "project_knowledge",
  "requested_output": "summary",
  "project": "Project Alpha",
  "allowed_projects": [
    "Project Alpha",
    "Project Beta"
  ]
}
